{
    "$schema": "http://json-schema.org/draft-07/schema",
    "title": "Online Tool",
    "type": "object",
    "required": ["name", "game", "description", "authors"],
    "properties": {
        "name": {
            "description": "User-friendly name of the tool, shown on the Online Tools page.",
            "type": "string"
        },
        "game": {
            "description": "Which game is this tool relevant for?",
            "type": "string",
            "enum": ["general", "smw", "yi", "sm64", "smb2"]
        },
        "description": {
            "description": "A short description of the tool's purpose. More detailed instructions should be included in the tool itself.",
            "type": "string"
        },
        "authors": {
            "type": "array",
            "items": {"$ref": "#/definitions/author"}
        }
    },
    "additionalProperties": false,
    "definitions": {
        "author": {
            "type": "object",
            "required": ["name"],
            "properties": {
                "name": {
                    "description": "The author's name, usually their current username on SMW Central.",
                    "type": "string"
                },
                "user": {
                    "description": "The author's user ID on SMW Central if they have an account.",
                    "type": "number"
                }
            },
            "additionalProperties": false
        }
    }
}
