{
    "name": "BPS Patcher (Flips alternative)",
    "game": "general",
    "description": "Applies BPS patches.",
    "authors": [
        {"name": "Sir_Walrus", "user": 1686},
        {"name": "trillian", "user": 32552},
        {"name": "Telinc1", "user": 15661},
        {"name": "CircleFriendo", "user": 49634}
    ]
}
